category,topic,subtopic_search_term,wiki_title,content,revision_id,permanent_link,content_id
Criminal Justice and Law Enforcement,Police,Police,Police impersonation,"Police impersonation is the act of falsely portraying oneself as a member of the police for the purpose of deception.

Typology and methods
Criminology research has developed a typology of police impersonators, categorizing offenders as (1) ""police enthusiasts"" (or ""wannabe cops""); (2) compulsive deviants; and (3) common criminals seeking material gain through thefts and robberies committed through vehicle pull-overs and home invasions.
A 2012 article in the American Journal of Criminal Justice noted that ""Distinguishing between real and phony officers can be difficult, and impersonators present themselves in numerous manners and commit a wide variety of crimes. Impersonators do more than just pretend to be a law enforcement officer. At times, impersonators engage in serious and wide ranging crimes including robbery, rape, and homicide."" The same study found that ""in general, police impersonators, depending on the type of offense, may be easily deterred. In vehicle pull-over cases, most impersonators fled when the targeted victim was on the phone with 911 verifying the legitimacy of the stop. Additionally, potential victims who questioned the legitimacy of the stop and challenged the fake officer tended to avoid further victimization.""
The 2012 study examined 56 police impersonation episodes from May 2002 to February 2010 from three U.S. metropolitan areas, dealing with 63 offenders and 71 victims. The study found that these incidents ""most often involve one victim (76%), one offender (91%), no witnesses (75%), no weapon (68%), and result in no injury to the victim (96%)."" The mean value of cash and property lost was $616. Of police impersonation episodes, 45% occurred on a highway, roadway, or alley; 20% occurred in or near the victim's home (such as a fake ""knock and talk""); and 34% occurred in some other place. The study found that only 46% of police impersonation incidents were ""cleared"" (i.e., arrest made or resolved in some other way).
Police impersonation has also facilitated extortion and assault. Police ""wannabees"" may drive cars equipped with police-style emergency lights, wear police uniforms, and carry fake police badges. Some sexual predators have impersonated police to commit sexual abuse, harassment, and rape. Impersonation involving police vehicle and uniforms has also been used by Mexican drug cartels to smuggle currency across the U.S.–Mexico border; within Mexico, Gulf Cartel operatives have also posed as members of the Mexican police and military.
In the United Kingdom, police impersonation ""with intent to deceive"" is criminalised by Section 90 of the Police Act 1996. The same section also restricts the sale of police uniforms and paraphernalia, although illicit trade in items such as warrant cards continues in the UK.

History
Police impersonation has a long history. In 17th and 18th-century London, impostors presented to be constables, Marshalsea, or sheriffs' officers to extort bribes or commit sex crimes. Between 1685 and 1701, 29 men in London were caught assuming the identities of law officers. In 18th-century Qing China, the police, officials, and yamen runners were often vulnerable to impersonation. There were almost 150 surviving recorded cases in Nazi Germany of impersonations of its police, mostly the notorious Gestapo secret police. A study by Robert Gellately concluded that: ""As the Gestapo and to some considerable extent also the Kripo attained a reputation for ruthlessness, brutality and mystery, their powers and reputation not only deterred, but called forth amateur imitators. From the point-of-view of impostors, the Gestapo (and Kripo) had the additional advantage of being detectives operating mostly in civilian clothes.""
In Nigeria, impersonation of Nigeria Police Force officers remains a problem, inhibiting public confidence in police.
During a two-day rampage in Nova Scotia in April 2020, the perpetrator, who killed 22 people, posed as a Royal Canadian Mounted Police officer and a drove a replica RCMP cruiser.

Effects
There is a limited body of research concerning police impersonation. Some scholars suggest that police impersonation may weaken public confidence in law enforcement and trust in authority, ""particularly if victims believe that the event was a 'legitimate' police action undertaken by a corrupt cop.""

See also

Impersonating a public servant
Impersonation of ICE agents
Military impostor
Jeremy Dewitte


== References ==",1287286598,https://en.wikipedia.org/w/index.php?title=Police_impersonation&oldid=1287286598,a9c46a418b99
Criminal Justice and Law Enforcement,Police,Police,Police Squad!,"Police Squad! is an American crime comedy television series that was broadcast on the ABC network in 1982. It was created by David Zucker, Jim Abrahams, and Jerry Zucker, starring Leslie Nielsen as Frank Drebin. A spoof of police procedurals and many other television shows and movies, the series features Zucker, Abrahams, and Zucker's usual sight gags, wordplay, and non sequiturs. It resembles the Lee Marvin police show M Squad (in particular the opening credits) and the late 1960s series Felony Squad. It was canceled after six episodes, and yielded The Naked Gun film series from 1988 to 1994.

Overview
Police Squad! was created by David Zucker, Jim Abrahams, and Jerry Zucker (ZAZ), who had previously worked on the films The Kentucky Fried Movie (1977) and Airplane! (1980). ZAZ wanted to make another spoof film similar to Airplane!, using the television series M Squad as a basis for the spoof. Lacking an overarching plot to the concept, Paramount Pictures president Michael Eisner instead secured them a six-episode television series, despite ZAZ wanting to make it into a film.
The show aired as a mid-season replacement in March 1982, but was taken off the schedule after four episodes. The remaining two episodes were dumped onto the summer schedule in place of the usual summer reruns. Against critical acclaim, the show was canceled by ABC after just six episodes. The show gained a strong cult following through repeat broadcasts on cable channels.
Alan North played Captain Ed Hocken, and Peter Lupus co-starred as Officer Norberg. In the films, those roles were played by George Kennedy and O. J. Simpson respectively, with Norberg renamed Nordberg. The only actors who reprised their roles in the films are Leslie Nielsen, Ed Williams as scientist Ted Olson, and Ronald ""Tiny Ron"" Taylor as the very tall Al. Joyce Brothers played herself in the fourth episode and in The Naked Gun: From the Files of Police Squad!. Robert Goulet, one of the ""special guest stars"" killed during the title sequence, plays the villain Quentin Hapsburg in The Naked Gun 2½: The Smell of Fear.

Episodes
Each episode's voiced title differs from that displayed on screen. In the following list, the voiced title is in parentheses.

Cast
Leslie Nielsen as Frank Drebin, detective lieutenant of Police Squad. Jerry Zucker explained that the name Drebin was picked blindly from the phone book. Zucker, Abrahams, and Zucker had met Nielsen when working on Airplane! (1980) and decided that their kind of humor matched. The team said that Nielsen would be perfect as Drebin, as the character lampooned the roles that Nielsen had played in television dramas such as The Bold Ones: The Protectors and S.W.A.T.
Alan North as Ed Hocken, captain of Police Squad and Drebin's superior officer. in The Naked Gun film series, the role was recast to George Kennedy.
Peter Lupus as Norberg, a dimwitted officer who serves under Drebin. In The Naked Gun films, the character was slightly renamed to ""Nordberg"" and recast to O.J. Simpson.
Ed Williams as Ted Olson, a lab technician at Police Squad. Prior to being cast, Williams had been a science teacher for many years and had some previous acting experience. Zucker, Abrahams, and Zucker were amazed by his performance.
William Duell as Johnny the Snitch, a shoeshiner who acts as an informant for Drebin on multiple cases. Johnny is the only recurring character from Police Squad! to not appear in any of The Naked Gun films.
Ronald ""Tiny Ron"" Taylor as Al, an abnormally tall officer whose head is always placed out of frame.
Rex Hamilton is also credited in every episode as ""Abraham Lincoln"", with the same clip in all opening credits as his only appearance.

Production
Opening sequence
The show's opening sequence is a satire on traditional crime-drama opening sequences, particularly those of M Squad and various Quinn Martin shows such as The Fugitive and particularly The New Breed (which also stars Nielsen). Hank Simms, who had worked as an announcer for some of Martin's programs, announced the title of each episode, though the spoken title never matches the title caption. The sequence introduces Nielsen and North during a shootout, and Abraham Lincoln impersonator Rex Hamilton, who dramatically returns gunfire to John Wilkes Booth, as his only appearance.
Another recurring gag in the opening credits sequence is the ""special guest star"", a celebrity who is introduced but immediately murdered. These special guest stars are Lorne Greene, Georg Stanford Brown, Florence Henderson, William Shatner, Robert Goulet, and William Conrad. John Belushi was slated as ""special guest star"" for the fifth episode and a scene with Belushi tied to blocks of concrete under water was filmed. Following Belushi's unexpected death in March 1982, the scene was replaced with footage of Florence Henderson before the episode was broadcast the following July. Belushi's accidental death shocked Zucker, Abrahams, and Zucker, as they had joked about it after he had nearly choked during the filming of the scene. A list of possible celebrity death shots was included in the DVD release.

Writing
The show was intended to mock police dramas in the same way in which Airplane! mocks disaster movies. Zucker, Abrahams, and Zucker wrote the pilot episode, in which most straight lines were directly copied from an M Squad episode. The pilot episode is a near scene-for-scene remake of ""More Deadly"", the opening episode of the second season of M Squad. Pat Proft, who had worked with Zucker, Abrahams, and Zucker on The Kentucky Fried Movie (1977) and Airplane! (1980), wrote the third episode. Robert Wuhl was invited to join the writing staff after he had auditioned for the lead role in Airplane!. He co-wrote the show's second and sixth episodes with Tino Insana. Both episodes contain cultural references to old movies such as On the Waterfront and The French Connection. In Wuhl's audio commentary for the DVD, he mentioned that it was a nice opportunity, but that he did not really feel a connection with the show, especially because of its short run.

Direction
The first episode of Police Squad! was directed by Jim Abrahams, David Zucker, and Jerry Zucker. Two of the show's six episodes were directed by filmmaker Joe Dante, who recalled in 2008,

I knew the Zuckers from second unit on Rock 'n' Roll High School and Kentucky Fried Movie and had turned down Airplane! – don’t ask! When they got Police Squad! going, they asked me to do the second one. It only lasted six episodes, two of which I directed.
ABC had no idea what to do with the show, which had no laugh track and resembled a rerun of a ’60s program. The network kept changing the time slot so no one could find it, and people casually switching it on thought it really was an old TV show! Like they did in their features, the boys used real TV episodes as their template, mostly a ’50s Lee Marvin series called M Squad. It was lots of fun to do and was the first thing I ever directed on a studio lot. I prefer the TV show to the later Naked Gun movies.

Cancellation
ABC announced the cancellation of Police Squad! after four of its six episodes had aired in March 1982. The final two episodes were aired that summer. In an interview for the DVD release of the series, Nielsen said ABC entertainment president Tony Thomopoulos asserted Police Squad! was canceled because viewers had to pay close attention to the show in order to get much of the humor: ""the viewer had to watch it in order to appreciate it"". Nielsen also thought the premise was more effective in the successful Naked Gun films because the much larger screen size in a cinema increases the efficacy of the visual gags. In its annual ""Cheers and Jeers"" issue, TV Guide magazine called the explanation for the cancellation ""the most stupid reason a network ever gave for ending a series"".

Home media
In 1985, Paramount Home Video first released all six episodes of the show on VHS, Betamax, and LaserDisc formats as two separate volumes: Police Squad!: Help Wanted! and More! Police Squad!, each with three episodes in their production order. Paramount and CBS DVD first released the series on DVD in 2006 in a keep case on one disc. The episodes are in airing order from ABC. The DVD extras include production notes from network executives, a ""freeze-frame"" that was filmed but never used, bloopers, casting tests, and an interview with Nielsen. Zucker, Abrahams, and Zucker, producer Robert K. Weiss, and writer Robert Wuhl recorded audio commentary for the first, third, and sixth episodes. Critics universally praised how the show was still funny after more than 20 years. The series was released in Blu-ray format in the US on April 14, 2020.

Legacy
Naked Gun film series
After the cancellation of Police Squad!, ZAZ returned to films, creating the comedies Top Secret! and Ruthless People. At this point, they were able to identify a narrative to apply to the Police Squad! formula for a theatrical film by adding a romantic plotline, and the film The Naked Gun: From the Files of Police Squad! was readily greenlit by Paramount. It performed well at the box office, grossing around $78,756,177. The film led to the Naked Gun trilogy with two sequels, The Naked Gun 2½: The Smell of Fear (1991) and Naked Gun 33+1⁄3: The Final Insult (1994), were released. The Naked Gun 2+1⁄2: The Smell of Fear was considered the most successful of the three, grossing around $86,930,411, and Naked Gun 33+1⁄3: The Final Insult grossed $51,132,598. Roger Ebert rated the first movie 3+1⁄2 out of four stars and gave three stars to each of the two following films.

Spin-offs
A series of British advertisements for Red Rock Cider were made in the same style, with the opening titles changed to other names such as ""Fraud Squad"" or ""Fried Squid"", and featuring Leslie Nielsen. The advertisements were shown in British cinemas as well as on television. They were directed by John Lloyd, with such apparent success that Zucker, Abrahams, and Zucker approached him to direct Naked Gun 33+1⁄3: The Final Insult, but he turned them down. During the WWE's SummerSlam 1994 pay-per-view event, the Police Squad! characters look for The Undertaker, who had previously vanished.

Reception
Critical response
On Rotten Tomatoes, Police Squad! has an aggregate score of 90% based on 28 positive and three negative critic reviews.  The website’s consensus reads: ""Wacky, inventive, and endlessly quotable, Police Squad! is a hysterically funny leap forward for TV comedy that was tragically ahead of its time.""
Upon the home video release in 1985, Washington Post critic Tom Shales commented ""People can rent them and laugh, and then cry that ABC was so cruel."" In 2009, the DVD set was nominated for a Satellite Award for Best DVD Release of a TV Show, though it lost to the DVD set of the eighth season of Fox's The Simpsons. In 2013, TV Guide ranked it #7 on its list of 60 shows that were ""Cancelled Too Soon"".
Matt Groening, creator of The Simpsons, has said, ""If Police Squad! had been made twenty years later, it would have been a smash. It was before its time. In 1982 your average viewer was unable to cope with its pace, its quick-fire jokes. But these days they'd have no problems keeping up, I think we've proved that.""

Awards and nominations
See also
Sledge Hammer!, a sustained satire of Dirty Harry and other action heroes
A Touch of Cloth, a 2012 UK crime spoof miniseries
Angie Tribeca, a 2016 TV crime spoof series

References
External links

Police Squad! at IMDb
The TV MegaSite's Police Squad Site
""Transcribed scripts for all 6 episodes"". PoliceSquadScripts.com. Archived from the original on March 7, 2021. Retrieved March 7, 2021.
""Script of the unproduced seventh episode ""Testimony Of Terror"""" (PDF). davidmisch.com. Retrieved November 1, 2021.",1292841505,https://en.wikipedia.org/w/index.php?title=Police_Squad%21&oldid=1292841505,05566c3c019a
